{
  "$schema": "https://json-schema.org/draft/2020-12/schema",
  "$id": "https://aph.tools/schema/priority_model.schema.json",
  "title": "APH State Funding Priority Model",
  "description": "Canonical configuration for a state aviation funding priority model. Round-trips Wyoming, MnDOT, ALDOT, Louisiana, and the six ACRP Synthesis 123 case examples.",
  "type": "object",
  "required": ["schema_version", "metadata", "criteria", "weighting_model", "governance"],
  "additionalProperties": false,
  "properties": {
    "schema_version": {
      "type": "string",
      "const": "1.0.0"
    },
    "metadata": {
      "type": "object",
      "required": ["name", "state", "model_version", "last_updated"],
      "additionalProperties": false,
      "properties": {
        "name": { "type": "string" },
        "state": { "type": "string" },
        "agency": { "type": "string" },
        "model_version": { "type": "string" },
        "last_updated": { "type": "string", "format": "date" },
        "source_citation": { "type": "string" },
        "decisions_log": {
          "type": "array",
          "description": "Append-only log of design decisions for auditability.",
          "items": {
            "type": "object",
            "required": ["date", "decision"],
            "properties": {
              "date": { "type": "string", "format": "date" },
              "author": { "type": "string" },
              "decision": { "type": "string" },
              "rationale": { "type": "string" },
              "source": { "type": "string" }
            }
          }
        }
      }
    },
    "eligibility_gate": {
      "type": "object",
      "description": "Optional pre-scoring eligibility filter (Louisiana pattern). Projects failing the gate are excluded from ranking.",
      "additionalProperties": false,
      "properties": {
        "enabled": { "type": "boolean" },
        "filters": {
          "type": "array",
          "items": { "$ref": "#/$defs/eligibility_filter" }
        }
      }
    },
    "criteria": {
      "type": "array",
      "minItems": 1,
      "items": { "$ref": "#/$defs/criterion" }
    },
    "weighting_model": {
      "type": "string",
      "enum": ["multiplicative", "additive_100pt", "formula", "dual_objective_subjective"],
      "description": "How criterion scores are combined. multiplicative: sum of (criterion.weight * subcategory.score) — Wyoming. additive_100pt: sum of capped per-criterion points — MnDOT, ALDOT. formula: arbitrary expression evaluated over criterion scores — Illinois. dual_objective_subjective: objective scoring + subjective override layer — North Dakota."
    },
    "global_formula": {
      "type": "string",
      "description": "Required when weighting_model = formula. Safe expression syntax referencing criterion ids, e.g. '(4*A + 2*C + 0.7*P + 0.7*T)/4.2 + X'. Evaluated with ast-based safe evaluator, never raw eval()."
    },
    "set_asides": {
      "type": "array",
      "description": "Funding portions reserved for specific project categories before ranking is applied.",
      "items": { "$ref": "#/$defs/set_aside" }
    },
    "adjustments": {
      "type": "object",
      "description": "Optional score adjustments applied after base scoring.",
      "additionalProperties": false,
      "properties": {
        "revenue_producing_bump": {
          "type": "object",
          "description": "Bonus for projects that don't compete well for FAA funds (~33% of states use this per ACRP).",
          "properties": {
            "enabled": { "type": "boolean" },
            "bonus_amount": { "type": "number" },
            "applies_to_project_types": {
              "type": "array",
              "items": { "type": "string" }
            }
          }
        },
        "low_federal_priority_bonus": {
          "type": "object",
          "description": "Illinois pattern: bonus when FAA NPRS score falls below threshold.",
          "properties": {
            "enabled": { "type": "boolean" },
            "nprs_threshold": { "type": "number" },
            "bonus_amount": { "type": "number" }
          }
        },
        "tradeoff_layer": {
          "type": "object",
          "description": "North Dakota pattern: post-scoring sequencing rules.",
          "properties": {
            "enabled": { "type": "boolean" },
            "urgency_sort": { "type": "boolean" },
            "financial_impact_sort": { "type": "boolean" },
            "discretion_override_allowed": { "type": "boolean" }
          }
        }
      }
    },
    "governance": {
      "type": "object",
      "required": ["decision_authority", "decision_cadence"],
      "additionalProperties": false,
      "properties": {
        "decision_authority": {
          "type": "string",
          "description": "Who has final approval (e.g., 'Wyoming Aeronautics Commission')."
        },
        "decision_cadence": {
          "type": "string",
          "enum": ["annual", "quarterly", "monthly", "rolling", "biennial"]
        },
        "statute_required": { "type": "boolean" },
        "statute_citation": { "type": "string" },
        "model_review_cycle_years": {
          "type": "number",
          "description": "How often the model itself is reviewed and re-approved."
        },
        "scoring_authority": {
          "type": "string",
          "description": "Who computes the scores (typically division staff)."
        },
        "approval_process": {
          "type": "string",
          "description": "Plain-language description of the path from scoring to final approval."
        }
      }
    },
    "disclaimer": { "type": "string" }
  },

  "$defs": {
    "criterion": {
      "type": "object",
      "required": ["id", "label", "scoring_style"],
      "additionalProperties": false,
      "properties": {
        "id": {
          "type": "string",
          "pattern": "^[a-z][a-z0-9_]*$",
          "description": "snake_case identifier, used in formulas."
        },
        "label": { "type": "string" },
        "description": { "type": "string" },
        "weight": {
          "type": "number",
          "description": "Required when weighting_model = multiplicative. Multiplied with the selected subcategory score."
        },
        "max_points": {
          "type": "number",
          "description": "Required when weighting_model = additive_100pt. The cap for this criterion."
        },
        "bucket": {
          "type": "string",
          "description": "Optional grouping label (e.g., 'System Plan Alignment' for MnDOT's 60-pt bucket)."
        },
        "project_field": {
          "type": "string",
          "description": "Project field/column the engine consults to resolve a subcategory match. If absent, defaults to the criterion id. Subcategory-level field_match overrides this."
        },
        "acrp_category": {
          "type": "string",
          "enum": [
            "agency_goals",
            "safety_security",
            "environment",
            "community_impact",
            "competition",
            "operational_effectiveness",
            "energy",
            "demand_accommodation",
            "level_of_service",
            "congestion",
            "sustainability",
            "economic_development",
            "revenue_cost",
            "asset_preservation",
            "benefit_cost",
            "risk",
            "regulatory_mandate",
            "system_plan_alignment"
          ],
          "description": "Mapping to ACRP Synthesis 123 14-criterion taxonomy (extended with system_plan_alignment which appears in every state model)."
        },
        "scoring_style": {
          "type": "string",
          "enum": ["select_one", "select_many", "tiered_score", "flat_lookup", "accumulating", "formula"],
          "description": "How this criterion produces a score. select_one: pick one subcategory. select_many: sum of selected subcategory scores. tiered_score: pick the matching tier (with possible negative scores). flat_lookup: project field maps to a fixed score (ALDOT project-type table). accumulating: sum of all qualifying subcategories up to max_points (Wyoming Airport Protection). formula: per-criterion expression."
        },
        "subcategories": {
          "type": "array",
          "items": { "$ref": "#/$defs/subcategory" }
        },
        "formula": {
          "type": "string",
          "description": "Per-criterion expression when scoring_style = formula."
        },
        "external_metric_source": {
          "type": "string",
          "description": "Optional URL or system reference for live data (e.g., 'https://mnsasp-mndot.hub.arcgis.com/' for MnDOT's MnSASP Hub)."
        },
        "negative_scores_allowed": {
          "type": "boolean",
          "default": false,
          "description": "Set true for criteria like MnDOT's compliance scoring where non-compliance subtracts."
        }
      }
    },

    "subcategory": {
      "type": "object",
      "required": ["id", "label", "score"],
      "additionalProperties": false,
      "properties": {
        "id": { "type": "string", "pattern": "^[a-z][a-z0-9_]*$" },
        "label": { "type": "string" },
        "score": { "type": "number" },
        "condition": {
          "type": "string",
          "description": "Plain-language match condition (e.g., 'Project clears Part 77 obstructions')."
        },
        "field_match": {
          "type": "object",
          "description": "Structured match against project fields. Optional; if present, engine can auto-select.",
          "properties": {
            "field": { "type": "string" },
            "operator": {
              "type": "string",
              "enum": ["eq", "ne", "in", "not_in", "gte", "lte", "gt", "lt", "matches"]
            },
            "value": {}
          }
        },
        "notes": { "type": "string" }
      }
    },

    "set_aside": {
      "type": "object",
      "required": ["id", "label", "allocation_pct"],
      "additionalProperties": false,
      "properties": {
        "id": { "type": "string", "pattern": "^[a-z][a-z0-9_]*$" },
        "label": { "type": "string" },
        "allocation_pct": {
          "type": "number",
          "minimum": 0,
          "maximum": 100
        },
        "eligibility_filter": {
          "type": "string",
          "description": "Plain-language rule for which projects are eligible for this set-aside."
        },
        "field_filter": { "$ref": "#/$defs/field_match_block" }
      }
    },

    "eligibility_filter": {
      "type": "object",
      "required": ["id", "label", "rule"],
      "additionalProperties": false,
      "properties": {
        "id": { "type": "string", "pattern": "^[a-z][a-z0-9_]*$" },
        "label": { "type": "string" },
        "rule": {
          "type": "string",
          "description": "Plain-language eligibility rule."
        },
        "field_check": { "$ref": "#/$defs/field_match_block" },
        "on_fail": {
          "type": "string",
          "enum": ["exclude", "warn", "flag_for_review"],
          "default": "exclude"
        }
      }
    },

    "field_match_block": {
      "type": "object",
      "required": ["field", "operator", "value"],
      "properties": {
        "field": { "type": "string" },
        "operator": {
          "type": "string",
          "enum": ["eq", "ne", "in", "not_in", "gte", "lte", "gt", "lt", "matches"]
        },
        "value": {}
      }
    }
  }
}
